Title,Description,Link
LoRa,digital wireless data communication technology,https://www.wikiwand.com/en/LoRa
MSC Software Corporation,that specializes in simulation software,https://www.wikiwand.com/en/MSC_Software
Why no one understands you,... and what to do about it,https://www.youtube.com/watch?v=owORxKqX0nU
Richard Stallman,personal website,https://stallman.org/
ricing,customize smartphone UI,https://homescreens.org/wiki/
Dave Cutler,most influential and game changing engineer ever,https://news.microsoft.com/features/the-engineers-engineer-computer-industry-luminaries-salute-dave-cutlers-five-decade-long-quest-for-quality/
countly,Secure and extensible product analytics,https://count.ly/
TEAL organization wiki,based on the book Reinventing Organizations,,http://www.reinventingorganizationswiki.com/Main_Page
nim programming language,Statically typed and compiled,https://nim-lang.org/
sql.js,SQLite compiled to javascript,https://github.com/kripken/sql.js/
tiling window manager,,https://www.wikiwand.com/en/Tiling_window_manager
Boyd's Law of Iteration,speed is more important than quality,https://blog.codinghorror.com/boyds-law-of-iteration/
,Peter Norvig,https://norvig.com/21-days.html
code kata,experience is the only teacher,http://codekata.com/
A Better Path to Enterprise Architectures,,https://gbds.us/clientuploads/downloads/A_Better_Path.pdf
SICP in the classroom,videos,https://ocw.mit.edu/courses/electrical-engineering-and-computer-science/6-001-structure-and-interpretation-of-computer-programs-spring-2005/video-lectures/
git-annex,managing files with git, without checking the file contents into git,https://git-annex.branchable.com/
How to Design Programs,little brother to SICP,https://htdp.org/2018-01-06/Book/index.html
book of proof,,https://www.people.vcu.edu/~rhammack/BookOfProof/
discrete maths,free discrete maths textbook,http://discrete.openmathbooks.org/dmoi3.html
list maths textbooks,American institute of Mathematics approved textbooks ,https://aimath.org/textbooks/approved-textbooks/
The Phoenix Project,novel : lean in IT, devops,https://www.amazon.ca/Phoenix-Project-DevOps-Helping-Business/dp/0988262592
Poignant Guide,Guide to Ruby,https://poignant.guide/book/
Apache Guacamole,ssh to your PC from any webbrowser,https://guacamole.apache.org/
interview prep,,https://steve-yegge.blogspot.com/2008/03/get-that-job-at-google.html
Algorithm design manual,using algos and data structures to solve common problems,"http://www.algorist.com/
"
Steve Yegge,influential engineer blogger,https://www.wikiwand.com/en/Steve_Yegge
sourcerer,visual analysis of library use,https://sourcerer.io/
guerilla mail,disposable temporary email address,https://www.guerrillamail.com/
grids ,dynamic grid layout,https://github.com/e-oj/Magic-Grid
dark patterns UI design,Dark Patterns are tricks used in websites,https://darkpatterns.org/
ECMAScript 6,new version of Javascript,http://exploringjs.com/es6/
typography : quotation marks,proper quote marks relative to context (english language),http://smartquotesforsmartpeople.com/
webAssembly,a binary format for the web,http://2ality.com/2015/06/web-assembly.html
makefile,file containing a set of directives,https://www.wikiwand.com/en/Makefile
RUP,Rational Unified Process,https://en.wikipedia.org/wiki/Rational_Unified_Process
Marvin Minsky - MIT,philosophical reflexions about programming computers,https://web.media.mit.edu/~minsky/papers/Why%20programming%20is--.html
the Jargon file,a comprehensive compendium of hacker slang,http://www.catb.org/jargon/html/
electron.js,Electron allows the development of desktop GUI applications,https://www.quora.com/What-do-you-need-to-know-to-learn-Electron-JS-framework
Structure and interpretation of computer programs,,https://mitpress.mit.edu/sites/default/files/sicp/index.html
ABP generator,abstract syntax tree,https://www.wikiwand.com/en/Abstract_syntax_tree
Apache Kafka,a distributed streaming platform,https://kafka.apache.org/
learning Haskell,,http://learnyouahaskell.com/chapters
temporary file hosting,,https://uguu.se/
Intel C++ Compiler,,https://www.wikiwand.com/en/Intel_C%2B%2B_Compiler
VHDL,Hardware Description Language,https://www.wikiwand.com/en/VHDL
normalize.css,A modern, HTML5-ready alternative to CSS resets,https://necolas.github.io/normalize.css/
"ABAP
",SAP's 4th gen language,https://www.wikiwand.com/en/ABAP
